{
  "schema_version": "1.0.0",
  "request_id": "toolreq_01HZZ0APPLYEDITPLANREQ000001",
  "tool_name": "apply_edit_plan",
  "requested_at": "2026-04-14T20:20:06Z",
  "session_id": "session_01HZZ0FIRSTSLICE0000000001",
  "asset_id": "asset_01HZZ0FIRSTSLICEASSET00000001",
  "version_id": "ver_01HZZ0FIRSTSLICEBASE00000001",
  "caller": "agent-a-contract-fixture-track",
  "arguments": {
    "audio_version": {
      "schema_version": "1.0.0",
      "version_id": "ver_01HZZ0FIRSTSLICEBASE00000001",
      "asset_id": "asset_01HZZ0FIRSTSLICEASSET00000001",
      "lineage": {
        "created_at": "2026-04-14T20:20:02Z",
        "created_by": "modules/io",
        "reason": "initial import"
      },
      "audio": {
        "storage_ref": "storage/audio/ver_01HZZ0FIRSTSLICEBASE00000001.wav",
        "sample_rate_hz": 44100,
        "channels": 2,
        "duration_seconds": 4,
        "frame_count": 176400,
        "channel_layout": "stereo"
      },
      "state": {
        "is_original": true,
        "is_preview": false
      }
    },
    "edit_plan": {
      "schema_version": "1.0.0",
      "plan_id": "plan_01HZZ0FIRSTSLICEPLAN00000001",
      "capability_manifest_id": "capmanifest_20260418B",
      "asset_id": "asset_01HZZ0FIRSTSLICEASSET00000001",
      "version_id": "ver_01HZZ0FIRSTSLICEBASE00000001",
      "user_request": "Tighten the lows, remove the harsh ring, brighten the top a little, and gently tilt the whole balance upward.",
      "created_at": "2026-04-17T20:30:05Z",
      "goals": [
        "reduce excess low-frequency weight",
        "remove a narrow harsh resonance",
        "add a little upper-band air",
        "shift the overall tonal balance slightly brighter"
      ],
      "constraints": [
        "keep all tonal moves subtle",
        "avoid hollowing out the body",
        "avoid making the top end brittle"
      ],
      "verification_targets": [
        "less low-end buildup below roughly 200 Hz",
        "reduced energy around the harsh resonance near 3.2 kHz",
        "slightly higher high-band energy without brittle peaks",
        "a modestly brighter high-vs-low spectral balance"
      ],
      "rationale": "Use a small deterministic tone-shaping chain that trims excess lows, removes the harsh ring, and adds a little air.",
      "steps": [
        {
          "step_id": "step_low_shelf_1",
          "operation": "low_shelf",
          "target": {
            "scope": "time_range",
            "start_seconds": 0.5,
            "end_seconds": 1.5
          },
          "parameters": {
            "frequency_hz": 180,
            "gain_db": -3,
            "q": 0.7
          },
          "expected_effects": ["reduce excess low-end weight", "leave the mids mostly intact"],
          "safety_limits": ["avoid making the source thin", "keep the bass cut gentle"]
        },
        {
          "step_id": "step_notch_filter_1",
          "operation": "notch_filter",
          "target": {
            "scope": "full_file"
          },
          "parameters": {
            "frequency_hz": 3200,
            "q": 8
          },
          "expected_effects": [
            "reduce a narrow harsh resonance",
            "keep surrounding presence intact"
          ],
          "safety_limits": ["avoid over-cutting the upper mids", "keep the move surgical"]
        },
        {
          "step_id": "step_tilt_eq_1",
          "operation": "tilt_eq",
          "target": {
            "scope": "full_file"
          },
          "parameters": {
            "pivot_frequency_hz": 1200,
            "gain_db": 2,
            "q": 0.6
          },
          "expected_effects": [
            "tilt the overall tone slightly brighter",
            "keep the pivot region stable"
          ],
          "safety_limits": ["avoid a dramatic rebalance", "do not exaggerate harshness"]
        },
        {
          "step_id": "step_high_shelf_1",
          "operation": "high_shelf",
          "target": {
            "scope": "full_file"
          },
          "parameters": {
            "frequency_hz": 6500,
            "gain_db": 2.5,
            "q": 0.8
          },
          "expected_effects": [
            "add a little upper-band air",
            "keep the added brightness broad and smooth"
          ],
          "safety_limits": ["avoid brittle highs", "keep the shelf subtle"]
        }
      ]
    },
    "output_dir": "storage/audio",
    "output_version_id": "ver_01HZZ0FIRSTSLICEEDIT00000001",
    "record_id": "transform_01HZZ0FIRSTSLICERECORD0001"
  }
}
